{
  "$schema": "../../config/sync-dashboard.schema.json",
  "schemaVersion": "1.1.0",
  "lastUpdated": "2025-07-29T10:50:00Z",
  "aggregatedState": {
    "status": "Warning",
    "totalTargets": 2,
    "synchronizedTargets": 1,
    "pendingDecisionTargets": 1,
    "conflictTargets": 0,
    "errorTargets": 0,
    "lastSyncMaster": "MAIN-PC"
  },
  "machines": {
    "MAIN-PC": {
      "lastSeen": "2025-07-29T10:50:00Z",
      "lastSyncDuration": "00:01:15",
      "lastSyncStatus": "SuccessWithPendingDecision",
      "targets": [
        {
          "id": "roo-shared-scripts-sync",
          "status": "Synchronized",
          "lastSyncCommit": "f9e8d7c6",
          "localPath": "D:/scripts/powershell"
        },
        {
          "id": "roo-approved-commands-sync",
          "status": "PendingDecision",
          "lastSyncAttempt": "2025-07-29T10:49:30Z",
          "message": "Une divergence a été détectée. Une entrée a été créée dans la feuille de route.",
          "roadmapEntryId": "decision-20250729-104930-a8b4"
        }
      ]
    }
  },
  "alerts": [
    {
      "level": "Warning",
      "message": "La cible 'roo-approved-commands-sync' sur MAIN-PC requiert une décision manuelle.",
      "timestamp": "2025-07-29T10:49:30Z",
      "source": "MAIN-PC",
      "details": {
        "targetId": "roo-approved-commands-sync",
        "roadmapEntryId": "decision-20250729-104930-a8b4"
      }
    }
  ]
}